Rank,Author,Title,Citations,Year,Source,cit/year
176," Akbulatov, LA Frolova, SA Tsarev…",Film Deposition Techniques Impact the Defect Density and Photostability of MAPbI3 Perovskite Films,31,2020,https://pubs.acs.org/doi/abs/10.1021/acs.jpcc.0c07673,5
319," Jamaludin, N Yantara, B Febriansyah…",Additives in halide perovskite for blue-light-emitting diodes: passivating agents or crystallization modulators?,31,2021,https://pubs.acs.org/doi/abs/10.1021/acsenergylett.1c02232,6
554,"Huang, F Cheng, B Wu, N Zheng","Intermediate chemistry of halide perovskites: origin, evolution, and application",30,2022,https://pubs.acs.org/doi/abs/10.1021/acs.jpclett.2c00013,8
57," Yang, JJ Wang, YC Yin, HB Yao",Mitigating halide ion migration by resurfacing lead halide perovskite nanocrystals for stable light-emitting diodes,30,2023,https://pubs.rsc.org/en/content/articlehtml/2018/ap/d3cs00179b,10
440,"K Khan, SS Urmi, TT Ferdous, S Azam…",Highly efficient Cesium Titanium (IV) Bromide perovskite solar cell and its point defect investigation: A computational study,30,2021,https://www.sciencedirect.com/science/article/pii/S0749603621001440,6
369,"Yang, T Zhao, MH Li, X Wu, M Han, SC Yang…",Passivation of positively charged cationic defects in perovskite with nitrogen-donor crown ether enabling efficient perovskite solar cells,30,2023,https://www.sciencedirect.com/science/article/pii/S1385894722044412,10
431,"Wang, X Zhang, W Zhu, Z Tang, J Liu, H Zhang…",Lewis base manipulated crystallization for efficient tin halide perovskite solar cells,30,2022,https://www.sciencedirect.com/science/article/pii/S0169433222019262,8
66,"Wang, Z Lin, J Su, Y Xu, X Guo, Y Li, M Zhang…",Dithiol surface treatment towards improved charge transfer dynamic and reduced lead leakage in lead halide perovskite solar cells,30,2022,https://onlinelibrary.wiley.com/doi/abs/10.1002/eom2.12185,8
141,"Ghosh, Q Shi, B Pradhan, A Mushtaq…",Light-induced defect healing and strong many-body interactions in formamidinium lead bromide perovskite nanocrystals,30,2020,https://pubs.acs.org/doi/abs/10.1021/acs.jpclett.9b03818,5
377,"Zhang, X Li, L Wang, J Yu, S Wageh…",Enhanced performance of CH3NH3PbI3 perovskite solar cells by excess halide modification,30,2021,https://www.sciencedirect.com/science/article/pii/S0169433221015361,6
351,"Wang, L Bi, Q Fu, AKY Jen",Methods for passivating defects of perovskite for inverted perovskite solar cells and modules,29,2024,https://onlinelibrary.wiley.com/doi/abs/10.1002/aenm.202401414,14
450," Kinigstein, H Tsai, W Nie, JC Blancon…",Edge states drive exciton dissociation in ruddlesden–popper lead halide perovskite thin films,29,2020,https://pubs.acs.org/doi/abs/10.1021/acsmaterialslett.0c00333,5
430,"Shukla, RR Kumar, D Punetha…","Design perspective, fabrication, and performance analysis of formamidinium tin halide perovskite solar cell",28,2023,https://ieeexplore.ieee.org/abstract/document/10043714/,9
256," VanOrman, L Nienhaus",Recent advancements in halide perovskite nanomaterials and their optoelectronic applications,28,2021,https://onlinelibrary.wiley.com/doi/abs/10.1002/inf2.12187,6
558,"Ahmad, RA Scheidt, MP Hautzinger, K Zhu…",Understanding the effect of lead iodide excess on the performance of methylammonium lead iodide perovskite solar cells,28,2022,https://pubs.acs.org/doi/abs/10.1021/acsenergylett.2c00850,7
486,"Li, D Maldonad","Stability diagrams, defect tolerance, and absorption coefficients of hybrid halide semiconductors: High-throughput first-principles characterization",28,2020,https://pubs.aip.org/aip/jcp/article/152/8/084106/199376,5
98," Tiede, ME Calvo, JF Galiste",Local rearrangement of the iodide defect structure determines the phase segregation effect in mixed-halide perovskites,28,2020,https://pubs.acs.org/doi/abs/10.1021/acs.jpclett.0c01127,5
52,"Ran, B Wang, Y Wu, D Liu…",Halide vacancies create no charge traps on lead halide perovskite surfaces but can generate deep traps in the bulk,28,2023,https://pubs.acs.org/doi/abs/10.1021/acs.jpclett.3c01231,9
103,"Ambrosio, E Mosconi, AA Alasmari…",Formation of color centers in lead iodide perovskites: Self-trapping and defects in the bulk and surfaces,28,2020,https://pubs.acs.org/doi/abs/10.1021/acs.chemmater.0c02005,5
218,"Zhang, LX Cao, Y Tang, Y Yu, Y Shen…","Blue halide perovskite materials: preparation, progress, and challenges",28,2023,https://onlinelibrary.wiley.com/doi/abs/10.1002/lpor.202200689,9
239,"Zhao, Z Shi, Y Zhou, X Wang, Y Xian, Y Dong…",Surface-defect-passivation-enabled near-unity charge collection efficiency in bromide-based perovskite gamma-ray spectrum devices,27,2024,https://www.nature.com/articles/s41566-023-01356-0,14
262,"Zhu, C Wang, P Zhang, S Ma, Y Chen, Y Zhang…",Topochemical assembly minimizes lattice heterogeneity in polycrystalline halide perovskites,27,2023,https://www.cell.com/joule/abstract/S2542-4351(23)00324-0,9
272," Ye, Y Li, Y Tian, XY Cai, Y Shen, KC Shen, X Gao…",Surface-induced phase engineering and defect passivation of perovskite nanograins for efficient red light-emitting diodes,27,2021,https://pubs.rsc.org/en/content/articlehtml/2020/nr/d0nr07677e,5
38," Swift, JL Lyons",Deep levels in cesium lead bromide from native defects and hydrogen,27,2021,https://pubs.rsc.org/en/content/articlehtml/2021/ta/d0ta11742k,5
472," Qiu, MH Li, JJ Qi, Y Jiang, JS Hu",Engineering inorganic lead halide perovskite deposition toward solar cells with efficiency approaching 20%,27,2021,https://onlinelibrary.wiley.com/doi/abs/10.1002/agt2.19,5
416," Selivanov, AO Murzin, VI Yudin, YV Kapitonov…","Counterdiffusion-in-gel growth of high optical and crystal quality MAPbX 3 (MA= CH 3 NH 3+, X= I−, Br−) lead-halide perovskite single crystals",27,2022,https://pubs.rsc.org/en/content/articlehtml/2022/ce/d2ce00096b,7
378,"Zhang, M Lyu, T Qiu, E Han, IK Kim, MC Jung, YH Ng…",Halide perovskite single crystals: Optoelectronic applications and strategical approaches,27,2020,https://www.mdpi.com/1996-1073/13/16/4250,4
350,"Yue, T Zhang, T Wang, X Yan, C Guo, X Qian…",Potassium stabilization of methylammonium lead bromide perovskite for robust photocatalytic H2 generation,27,2020,https://onlinelibrary.wiley.com/doi/abs/10.1002/eom2.12015,4
9," Smart, H Takenaka, TA Pham, LZ Tan…",Enhancing defect tolerance with ligands at the surface of lead halide perovskites,27,2021,https://pubs.acs.org/doi/abs/10.1021/acs.jpclett.1c01243,5
16,"Das, Z Liu, I Aguilera, U Rau, T Kirchartz",Defect tolerant device geometries for lead-halide perovskites,27,2021,https://pubs.rsc.org/en/content/articlehtml/2021/ma/d0ma00902d,5
487," Pham, A Singh, W Chen, MT Hoang…",Self-assembled carbon dot-wrapped perovskites enable light trapping and defect passivation for efficient and stable perovskite solar cells,27,2021,https://pubs.rsc.org/en/content/articlehtml/2021/ta/d1ta00036e,5
592,"Lin, L Chen, C He, Y Wang, X Li…",Vapor phase growth of centimeter‐sized band gap engineered cesium lead halide perovskite single‐crystal thin films with color‐tunable stimulated emission,26,2023,https://advanced.onlinelibrary.wiley.com/doi/abs/10.1002/adfm.202210278,9
514,"Wang, WJ Yin",Revisiting the iodine vacancy surface defects to rationalize passivation strategies in perovskite solar cells,26,2022,https://pubs.acs.org/doi/abs/10.1021/acs.jpclett.2c01815,6
110," Grandhi, D Hardy, M Krishnaiah…",Wide‐bandgap perovskite‐inspired materials: defect‐driven challenges for high‐performance optoelectronics,26,2024,https://advanced.onlinelibrary.wiley.com/doi/abs/10.1002/adfm.202307441,13
583," Kirmani, TA Byers, Z Ni, K VanSant…",Unraveling radiation damage and healing mechanisms in halide perovskites using energy-tuned dual irradiation dosing,26,2024,https://www.nature.com/articles/s41467-024-44876-1,13
380," Afroz, A Singh, RK Gupta, R Garai…",Design potential and future prospects of lead-free halide perovskites in photovoltaic devices,26,2023,https://pubs.rsc.org/en/content/articlehtml/2023/ta/d2ta07687j,9
101,"Ledinský, A Vlk, T Schönfeldová…",Impact of cation multiplicity on halide perovskite defect densities and solar cell voltages,26,2020,https://pubs.acs.org/doi/abs/10.1021/acs.jpcc.0c08193,4
100,"Menzel, A Tejada, A A",Revisiting the determination of the valence band maximum and defect formation in halide perovskites for solar cells: Insights from highly sensitive near–UV …,26,2021,https://pubs.acs.org/doi/abs/10.1021/acsami.1c10171,5
586,"Hu, Y Liu, Z Xie, Z Xiao, G Niu…",Observation of defect luminescence in 2D Dion–Jacobson perovskites,26,2021,https://advanced.onlinelibrary.wiley.com/doi/abs/10.1002/adom.202101423,5
233,"Guo, J Shi, Y Zhu, M Wu, J Du, Y Cen, S Liu…",Two-Dimensional 111-Type -Based Halide Perovskite  with Optimal Band Gap for Photovoltaics and Defect-Insensitive Blue Emission,26,2020,https://journals.aps.org/prapplied/abstract/10.1103/PhysRevApplied.13.024031,4
557,"Khatoon, SK Yadav, V Chakraborty, J Singh…",A simulation study of all inorganic lead-free CsSnBr3 tin halide perovskite solar cell,26,2023,https://www.sciencedirect.com/science/article/pii/S2214785323020631,9
293,"Stern, S Aharon, T Binyamin, A Karmi…",Electrical characterization of individual cesium lead halide perovskite nanowires using conductive AFM,26,2020,https://advanced.onlinelibrary.wiley.com/doi/abs/10.1002/adma.201907812,4
452,"Hu, JA Smith, HJ Snaith, A Wakamiya",Prospects for tin-containing halide perovskite photovoltaics,26,2023,https://pubs.acs.org/doi/abs/10.1021/prechem.3c00018,9
329," Gupta, R Garai, M Hossain…",Halide engineering for mitigating ion migration and defect states in hot-cast perovskite solar cells,26,2021,https://pubs.acs.org/doi/abs/10.1021/acssuschemeng.1c02537,5
590,"Yang, L Gutiérre",Air-resistant lead halide perovskite nanocrystals embedded into polyimide of intrinsic microporosity,25,2021,https://spj.science.org/doi/full/10.34133/2021/9873846,5
158,"Lapkin, C Kirsch, J Hiller, D Andrienko…",Spatially resolved fluorescence of caesium lead halide perovskite supercrystals reveals quasi-atomic behavior of nanocrystals,25,2022,https://www.nature.com/articles/s41467-022-28486-3,6
572,"Tan, T Huang, Y Yang",Defect passivation of perovskites in high efficiency solar cells,25,2021,https://iopscience.iop.org/article/10.1088/2515-7655/ac2e13/meta,5
340,"Xie, A Feng, L Wang, N Li, X Cheng…",Bulk defect suppression of micrometer-thick perovskite single crystals enables stable photovoltaics,25,2022,https://pubs.acs.org/doi/abs/10.1021/acsmaterialslett.2c00317,6
64,"Kumar, G Hodes, D Cahen",Defects in halide perovskites: The lattice as a boojum?,25,2020,https://www.cambridge.org/core/journals/mrs-bulletin/article/defects-in-halide-perovskites-the-lattice-as-a-boojum/37D5AF2AC07F37A2B032D9EC122E472B,4
86," Kara, D Cirak, B Gultekin",Decreased surface defects and non-radiative recombination via the passivation of the halide perovskite film by 2-thiophenecarboxylic acid in triple-cation perovskite …,25,2022,https://pubs.rsc.org/en/content/articlehtml/2022/cp/d2cp00341d,6
596,"Luo, Y Jiang, T He, M Yuan",Metal halide perovskites for blue light emitting materials,25,2020,https://pubs.aip.org/aip/apm/article/8/4/040907/1064504,4
211,"Sun, L Xu, X Lai, Z Li, M He",Advanced Strategies of Passivating Perovskite Defects for High‐Performance Solar Cells,25,2021,https://onlinelibrary.wiley.com/doi/abs/10.1002/eem2.12111,5
29,"Jin, D Zhao, F Liang, L Liu, D Liu, P Wang, M Qiu",Electron-beam irradiation induced regulation of surface defects in lead halide perovskite thin films,25,2021,https://spj.science.org/doi/full/10.34133/2021/9797058,5
362,"Shrestha, H Tsai, M Yoho, D Ghosh…",Role of the metal–semiconductor interface in halide perovskite devices for radiation photon counting,25,2020,https://pubs.acs.org/doi/abs/10.1021/acsami.0c11805,4
465," Akbulatov, MI Ustinova, L Gutsev, SA Tsarev…",When iodide meets bromide: Halide mixing facilitates the light-induced decomposition of perovskite absorber films,25,2021,https://www.sciencedirect.com/science/article/pii/S2211285521003396,5
8,"Kaiser, K Hussain, A Singh, AA Alothman…",Defect formation and healing at grain boundaries in lead-halide perovskites,25,2022,https://pubs.rsc.org/en/content/articlehtml/2022/ta/d2ta06336k,6
364,"Wang, X Duan, WJ Yin","Photoinduced dynamic defects responsible for the giant, reversible, and bidirectional light-soaking effect in perovskite solar cells",24,2021,https://pubs.acs.org/doi/abs/10.1021/acs.jpclett.1c02929,5
381,"Cha, MK Kim, W Lee, H Jin, H Na…",Perovskite nanowires as defect passivators and charge transport networks for efficient and stable perovskite solar cells,24,2023,https://www.sciencedirect.com/science/article/pii/S1385894722043996,8
71, Scheblykin,Small number of defects per nanostructure leads to “digital” quenching of photoluminescence: the case of metal halide perovskites,24,2020,https://advanced.onlinelibrary.wiley.com/doi/abs/10.1002/aenm.202001724,4
506,"Li, Z Xing, H Peng, X Meng, D Li…",Reactive Inhibition Strategy for Triple‐cation Mixed‐halide Perovskite Ink with Prolonged Shelf‐life,24,2022,https://advanced.onlinelibrary.wiley.com/doi/abs/10.1002/aenm.202200650,6
410,"Mączka, M Ptak, A Gągor, JK Zaręba…","Phase transitions, dielectric response, and nonlinear optical properties of Aziridinium lead halide perovskites",24,2023,https://pubs.acs.org/doi/abs/10.1021/acs.chemmater.3c02200,8
44," Wolf, A Jaffe, AH Slavney, WL Mao…",Tuning defects in a halide double perovskite with pressure,24,2022,https://pubs.acs.org/doi/abs/10.1021/jacs.2c08607,6
155,"She, Z Hou, OV Prezhdo, W Li",Identifying and Passivating Killer Defects in Pb-Free Double Cs2AgBiBr6 Perovskite,23,2021,https://pubs.acs.org/doi/abs/10.1021/acs.jpclett.1c03134,5
393," Lee, JW Lee",van der Waals metal contacts for characterization and optoelectronic application of metal halide perovskite thin films,23,2022,https://pubs.acs.org/doi/abs/10.1021/acsenergylett.2c01510,6
129,"Leupold, AL Seibel, R Moos…",Electrical conductivity of halide perovskites follows expectations from classical defect chemistry,23,2021,https://chemistry-europe.onlinelibrary.wiley.com/doi/abs/10.1002/ejic.202100381,5
123,"Sil, H Luitel, J Dhar, M Chakrabarti, PP Ray…",Defect induced room temperature ferromagnetism in methylammonium lead iodide perovskite,23,2020,https://www.sciencedirect.com/science/article/pii/S0375960120300712,4
448,"Zhou, T Pan, Z Ning",Strategies for enhancing the stability of metal halide perovskite towards robust solar cells,23,2022,https://link.springer.com/article/10.1007/s40843-022-2277-9,6
568,"Matheu, JA Vigil, EJ Crace, HI Karunadasa",The halogen chemistry of halide perovskites,23,2022,https://www.cell.com/trends/chemistry/abstract/S2589-5974(21)00280-X,6
209,"Tsvetkov, ME Khan, BC Moon, YH Kim, JK Kang",Strain-induced metallization and defect suppression at zipper-like interdigitated atomically thin interfaces enabling high-efficiency halide perovskite solar cells,23,2020,https://pubs.acs.org/doi/abs/10.1021/acsnano.0c09584,4
30," Milstein, JYD Roh, LM Jacoby, MJ Crane…",Ubiquitous near-band-edge defect state in rare-earth-doped lead-halide perovskites,23,2022,https://pubs.acs.org/doi/abs/10.1021/acs.chemmater.2c00132,6
370,"Luo, B Liu, T Zheng, X Luo, L Lu, B Tian, P Xu…",High-efficiency sky-blue perovskite light-emitting diodes via the trade-off between the electron–phonon coupling loss and defect passivation,23,2022,https://pubs.acs.org/doi/abs/10.1021/acsphotonics.2c00496,6
585,"Lee, S Wolfe, J Torres, M Yun…",Asymmetric Bipolar Resistive Switching of Halide Perovskite Film in Contact with TiO2 Layer,23,2021,https://pubs.acs.org/doi/abs/10.1021/acsami.1c06278,5
247,"Yan, L Zhao, C Zhao, S Lin",Theoretical Understanding of thermoelectric energy conversion efficiency in Lead-Free halide double perovskites showing intrinsic defect tolerance,23,2022,https://www.sciencedirect.com/science/article/pii/S1359431122009589,6
485,"Hu, X Guan, T Wan, CH Lin, S Liu, R Zhu…",Valence-regulated metal doping of mixed-halide perovskites to modulate phase segregation and solar cell performance,22,2022,https://pubs.acs.org/doi/abs/10.1021/acsenergylett.2c02040,6
511,"Stefańska, M Ptak, M Mączka","Synthesis, photoluminescence and vibrational properties of aziridinium lead halide perovskites",22,2022,https://www.mdpi.com/1420-3049/27/22/7949,6
398,"Kumar, A Kathiravan, MA Jhonsi","Beyond lead halide perovskites: Crystal structure, bandgaps, photovoltaic properties and future stance of lead-free halide double perovskites",22,2024,https://www.sciencedirect.com/science/article/pii/S2211285524002714,11
578," Durant, H Afshari, S Sourabh, V Yeddu…",Radiation stability of mixed tin–lead halide perovskites: implications for space applications,22,2021,https://www.sciencedirect.com/science/article/pii/S0927024821002762,4
436,"Kong, C Zhao, T Huang, X Li, J Xing…",Accurate adjusting the lattice strain of triple-cation and mixed-halide perovskites for high-performance photodetector,21,2022,https://pubs.acs.org/doi/abs/10.1021/acsami.2c02427,5
124,"Kaiser, E Mosconi, AA Alothman, D Meggiolaro…",Halide-driven formation of lead halide perovskites: insight from ab initio molecular dynamics simulations,21,2021,https://pubs.rsc.org/en/content/articlehtml/2021/ma/d1ma00371b,4
172,"Liu, K Xu, AL Allen, X Li, H Xia, L Peng…",Enhancing the photoluminescence and stability of methylammonium lead halide perovskite nanocrystals with phenylalanine,21,2021,https://pubs.acs.org/doi/abs/10.1021/acs.jpcc.0c11095,4
470,"Gao, C Luo, C Yan, W Li, C Liu, W Yang",Copper-doping defect-lowered perovskite nanosheets for deep-blue light-emitting diodes,21,2022,https://www.sciencedirect.com/science/article/pii/S0021979721015198,5
251,"Gao, K Tao, JL Sun, Q Yan",Gamma‐Ray Radiation Stability of Mixed‐Cation Lead Mixed‐Halide Perovskite Single Crystals,21,2022,https://onlinelibrary.wiley.com/doi/abs/10.1002/adom.202102069,5
530,"Liang, X Cui, F Li, C Stampfl, SP Ringer…",Electrode-induced impurities in tin halide perovskite solar cell material CsSnBr3 from first principles,20,2021,https://www.nature.com/articles/s41524-021-00533-5,4
56,"Guo, M Yuan, G Chen, F Liu, R Lu…",Understanding defects in perovskite solar cells through computation: current knowledge and future challenge,20,2024,https://onlinelibrary.wiley.com/doi/abs/10.1002/advs.202305799,10
232,"Qiu, J Sun, Z Zhang, T Shen, H Liu, J Qi",Achieving stable and high-efficiency (> 21%) lead halide perovskite solar cells with δ-CsPbI2Br seed–assisted growth strategy,20,2021,https://www.sciencedirect.com/science/article/pii/S2468606921002021,4
147,"Tang, S Wu, N AlMasoud, TS Alomar…",Defect passivation in perovskite films by p-methoxy phenylacetonitrile for improved device efficiency and stability,20,2023,https://link.springer.com/article/10.1007/s42114-023-00732-2,7
488,"Gegevičius, M Franckevičius…",The role of grain boundaries in charge carrier dynamics in polycrystalline metal halide perovskites,20,2021,https://chemistry-europe.onlinelibrary.wiley.com/doi/abs/10.1002/ejic.202100360,4
495,"Wang, C Wu, T Wu, H Yao, Y Hua, F Hao",π-Conjugated Lewis Base for Efficient Tin Halide Perovskite Solar Cells with Retarded Sn2+ Oxidation,20,2024,https://pubs.acs.org/doi/abs/10.1021/acsenergylett.4c00094,10
549,Mannod,Accelerated screening of functional atomic impurities in halide perovskites using high-throughput computations and machine learning,20,2022,https://link.springer.com/article/10.1007/s10853-022-06998-z,5
153,"Sheng, W Chen, F Hu, C Liu, Y Di…",Mechanism of photoinduced phase segregation in mixed-halide perovskite microplatelets and its application in micropatterning,19,2022,https://pubs.acs.org/doi/abs/10.1021/acsami.2c00590,5
135," Sabino, A Zunger, GM Dalpian",Intrinsic doping limitations in inorganic lead halide perovskites,19,2022,https://pubs.rsc.org/en/content/articlehtml/2021/xx/d1mh01371h,5
562,"J Kim, Z Liu, C Huang, JM Park, SJ Haeuser…",Terahertz nanoimaging of perovskite solar cell materials,19,2022,https://pubs.acs.org/doi/abs/10.1021/acsphotonics.2c00861,5
309,"Wang, N Chen, W Wang, Z Li, B Huang…",Room-Temperature Persistent Luminescence in Metal Halide Perovskite Nanocrystals for Solar-Driven CO2 Bioreduction,19,2023,https://www.chinesechemsoc.org/doi/abs/10.31635/ccschem.022.202101694,6
521,"Lai, D Shin, L Jibril, CA Mirkin",Combinatorial synthesis and screening of mixed halide perovskite megalibraries,19,2022,https://pubs.acs.org/doi/abs/10.1021/jacs.2c05082,5
131,"Li, H Li, Y Sun, MG Humphrey…",Defect-Dependent Nonlinear Absorption in the Lead-Free Double-Perovskite Cs2AgBiBr6,19,2023,https://pubs.acs.org/doi/abs/10.1021/acsami.2c23266,6
390,"Liu, K Song, X Zheng, J Yin, KX Yao…",Cyanamide passivation enables robust elemental imaging of metal halide perovskites at atomic resolution,19,2021,https://pubs.acs.org/doi/abs/10.1021/acs.jpclett.1c02830,4
593,"Li, J Shi, J Chen, Z Tan, H Lei",Lead-free halide double perovskite for high-performance photodetectors: Progress and perspective,19,2023,https://www.mdpi.com/1996-1944/16/12/4490,6
46,"Xue, JM Vicen",Compound Defects in Halide Perovskites: A First-Principles Study of CsPbI3,19,2023,https://pubs.acs.org/doi/abs/10.1021/acs.jpcc.2c06789,6
571,"Wei, M Ghasemi, R Wang, C Wang…","Metal halide perovskite alloy: fundamental, optoelectronic properties and applications",18,2023,https://advanced.onlinelibrary.wiley.com/doi/abs/10.1002/adpr.202200236,6
102,"Wang, T Li, Q Li, H Zhao, C Zheng, M Li…",Inhibition of buried cavities and defects in metal halide perovskite photodetectors via a two-step spin-coating method,18,2022,https://pubs.rsc.org/en/content/articlehtml/2021/xx/d2tc01033j,4
89,"Du, K He, X Zhao, B Li",Defect passivation scheme toward high-performance halide perovskite solar cells,18,2023,https://www.mdpi.com/2073-4360/15/9/2010,6
575,"Zhu, Y Xia, L Qin, K Zhang, J Liang, C Zhao, D Hong…",Reducing surficial and interfacial defects by thiocyanate ionic liquid additive and ammonium formate passivator for efficient and stable perovskite solar cells,18,2023,https://link.springer.com/article/10.1007/s12274-023-5403-x,6
90, Lyons,Effective donor dopants for lead halide perovskites,17,2021,https://pubs.acs.org/doi/abs/10.1021/acs.chemmater.1c01898,3
374,"Zhi, CQ Yang, MU Rothmann, HQ Du…",Direct Observation of Intragrain Defect Elimination in FAPbI3 Perovskite Solar Cells by Two-Dimensional PEA2PbI4,17,2023,https://pubs.acs.org/doi/abs/10.1021/acsenergylett.3c00685,6
389,"Il Jake Choi, LK Ono, H Cho, KJ Kim, HB Kang, Y Qi…",Pathways of Water-Induced Lead-Halide Perovskite Surface Degradation: Insights from In Situ Atomic-Scale Analysis,17,2023,https://pubs.acs.org/doi/abs/10.1021/acsnano.3c10611,6
248," Perez, D Ghosh, O Prezhdo, W Nie…",Point defects in two-dimensional ruddlesden–popper perovskites explored with ab initio calculations,17,2022,https://pubs.acs.org/doi/abs/10.1021/acs.jpclett.2c00575,4
76,"Geng, Z Xiao",Can nitride perovskites provide the same superior optoelectronic properties as lead halide perovskites?,17,2023,https://pubs.acs.org/doi/abs/10.1021/acsenergylett.3c00658,6
315," Woo, YK Jung, GY Kim, S Kim, A Walsh",Factors influencing halide vacancy transport in perovskite solar cells,16,2022,https://link.springer.com/article/10.1007/s43939-022-00029-z,4
207,"Ge, R Zheng, J Lin, H Chen",Cs2InCl5 (H2O): A moisture-stable defective double halide perovskite analogue with broadband emission,16,2020,https://www.sciencedirect.com/science/article/pii/S0167577X2030985X,3
174,"Niu, C Wang, J Zeng, Z Wang, Y Liu…",Ion migration in lead-halide perovskites: cation matters,15,2024,https://pubs.acs.org/doi/abs/10.1021/acs.jpclett.3c03451,8
189,"Zhang, D Tu, L Wang, C Li, Y Liu…",Transition metal ion-doped cesium lead halide perovskite nanocrystals: doping strategies and luminescence design,15,2024,https://pubs.rsc.org/en/content/articlehtml/2023/qm/d3qm00691c,8
538,"Chen, Z Feng, A Pal, J Zhang",Recent Progress on the Performance of Lead‐Based Halide Perovskite APbX3 Detectors,15,2022,https://onlinelibrary.wiley.com/doi/abs/10.1002/pssa.202200018,4
556,"Imran, H Raza, L Aziz, R Chen, S Liu, Z Jiang, Y Gao…",High Performance Inverted RbCsFAPbI3 Perovskite Solar Cells Based on Interface Engineering and Defects Passivation,15,2023,https://onlinelibrary.wiley.com/doi/abs/10.1002/smll.202207950,5
243,"Le, A Liu, Y Reo, S Bai, YY Noh, H Zhu",Ion migration in tin-halide perovskites,14,2024,https://pubs.acs.org/doi/abs/10.1021/acsenergylett.4c00198,7
497,"Ji, M Jin, Q Du, J Zheng, Y Feng, Z Shen…",Defect passivation with metal cations toward efficient and stable perovskite solar cells exceeding 22.7% efficiency,14,2021,https://pubs.acs.org/doi/abs/10.1021/acsaem.1c02048,3
424,"Ming, Z Chen, F Zhang, S Gong, X Wu…","Mixed Chalcogenide‐Halides for Stable, Lead‐Free and Defect‐Tolerant Photovoltaics: Computational Screening and Experimental Validation of CuBiSCl2 with …",14,2022,https://onlinelibrary.wiley.com/doi/abs/10.1002/adfm.202112682,4
82," Sabino, GM Dalpian…",Light‐Induced Frenkel Defect Pair Formation Can Lead to Phase‐Segregation of Otherwise Miscible Halide Perovskite Alloys,14,2023,https://onlinelibrary.wiley.com/doi/abs/10.1002/aenm.202301539,5
67,"Xu, Z Wu, Z Zhao, Z Lu, Y Gao, X Huang…",First-principles study of detrimental iodine vacancy in lead halide perovskite under strain and electron injection,13,2022,https://pubs.aip.org/aip/apl/article/121/9/092106/2833983,3
356,"Bian, F Cao, L Li",Performance Improvement of Lead‐Based Halide Perovskites through B‐Site Ion‐Doping Strategies,12,2023,https://onlinelibrary.wiley.com/doi/abs/10.1002/smll.202302700,4
