Rank,Author,Title,Citations,Year,Source,cit/year
116,"Ünlü, E Jung, J Haddad, A Kulkarni, S Öz, H Choi…",Understanding the interplay of stability and efficiency in A-site engineered lead halide perovskites,92,2020,https://pubs.aip.org/aip/apm/article/8/7/070901/594699,15
284," Frolova, SY Luchkin, Y Lekina…",Reversible Pb2+/Pb0 and I−/I3− Redox Chemistry Drives the Light‐Induced Phase Segregation in All‐Inorganic Mixed Halide Perovskites,91,2021,https://advanced.onlinelibrary.wiley.com/doi/abs/10.1002/aenm.202002934,18
536," Liu, CM Dai, Y Min, Y Hou, AH Proppe…",An antibonding valence band maximum enables defect-tolerant and stable GeSe photovoltaics,91,2021,https://www.nature.com/articles/s41467-021-20955-5,18
525," Senanayak, K Dey, R Shivanna, W Li, D Ghosh…",Charge transport in mixed metal halide perovskite semiconductors,90,2023,https://www.nature.com/articles/s41563-022-01448-2,30
414,"Attique, N Ali, S Ali, R Khatoon, N Li…","A potential checkmate to lead: bismuth in organometal halide perovskites, structure, properties, and applications",90,2020,https://onlinelibrary.wiley.com/doi/abs/10.1002/advs.201903143,15
4," Keeble, J Wiktor, SK Pathak, LJ Phillips…",Identification of lead vacancy defects in lead halide perovskites,90,2021,https://www.nature.com/articles/s41467-021-25937-1,18
322,"Zhang, C Zhou, X Feng, N Dong, H Chen…",Regulation of the luminescence mechanism of two-dimensional tin halide perovskites,90,2022,https://www.nature.com/articles/s41467-021-27663-0,22
367,"Zhang, K Li, M Sun, F Wang…",Design of superhydrophobic surfaces for stable perovskite solar cells with reducing lead leakage,88,2021,https://advanced.onlinelibrary.wiley.com/doi/abs/10.1002/aenm.202102281,18
258," Zhidkov, DW Boukhvalov, AF Akbulatov, LA Frolova…",XPS spectra as a tool for studying photochemical and thermal degradation in APbX3 hybrid halide perovskites,88,2021,https://www.sciencedirect.com/science/article/pii/S2211285520309988,18
165,"Ge, F Ye, M Xiao, H Wang, C Wang…",Internal encapsulation for lead halide perovskite films for efficient and very stable solar cells,88,2022,https://advanced.onlinelibrary.wiley.com/doi/abs/10.1002/aenm.202200361,22
443,"Naresh, N Lee",Zn (II)-doped cesium lead halide perovskite nanocrystals with high quantum yield and wide color tunability for color-conversion light-emitting displays,88,2020,https://pubs.acs.org/doi/abs/10.1021/acsanm.0c01254,15
388,"Luo, C Yan, W Li, F Chun, M Xie…",Ultrafast thermodynamic control for stable and efficient mixed halide perovskite nanocrystals,88,2020,https://onlinelibrary.wiley.com/doi/abs/10.1002/adfm.202000026,15
453,"U Hasan, DS Lee, SH Im, KH Hong",Present status and research prospects of tin‐based perovskite solar cells,86,2020,https://onlinelibrary.wiley.com/doi/abs/10.1002/solr.201900310,14
51,"Pi, X Jia, Z Long, S Yang, H Wu…",Surface and Defect Engineering Coupling of Halide Double Perovskite Cs2NaBiCl6 for Efficient CO2 Photoreduction,85,2022,https://advanced.onlinelibrary.wiley.com/doi/abs/10.1002/aenm.202202074,21
405,"R Perini, E Rojas‐Gatjens, M Ravello…",Interface reconstruction from Ruddlesden–Popper structures impacts stability in lead halide perovskite solar cells,84,2022,https://advanced.onlinelibrary.wiley.com/doi/abs/10.1002/adma.202204726,21
522,"Jannat, S Ahmed, MA Alim",Performance analysis of cesium formamidinium lead mixed halide based perovskite solar cell with MoOx as hole transport material via SCAPS-1D,83,2021,https://www.sciencedirect.com/science/article/pii/S0030402620320064,17
23,"Shen, K Kang, Z Yu, WH Jeong, H Choi, SH Park…",Passivation strategies for mitigating defect challenges in halide perovskite light-emitting diodes,81,2023,https://www.cell.com/joule/fulltext/S2542-4351(23)00039-9,27
27,"Andaji‐Garmaroudi, M Anaya…","Photobrightening in lead halide perovskites: observations, mechanisms, and future potential",81,2020,https://onlinelibrary.wiley.com/doi/abs/10.1002/aenm.201903109,14
281,"Shyamal, SK Dutta, T Das, S Sen…",Facets and Defects in Perovskite Nanocrystals for Photocatalytic CO2 Reduction,80,2020,https://pubs.acs.org/doi/abs/10.1021/acs.jpclett.0c01088,13
446," Kwak, DE Lee, SJ Kim, HW Jang",Halide perovskites for memristive data storage and artificial synapses,80,2021,https://pubs.acs.org/doi/abs/10.1021/acs.jpclett.1c02332,16
567,"Fu, S Hu, J Tang, Z Xiao",Material exploration via designing spatial arrangement of octahedral units: a case study of lead halide perovskites,80,2021,https://link.springer.com/article/10.1007/s12200-021-1227-z,16
206,"Kiligaridis, PA Frantsuzov, A Yangui, S Seth…",Are Shockley-Read-Hall and ABC models valid for lead halide perovskites?,80,2021,https://www.nature.com/articles/s41467-021-23275-w,16
263,"Moia, J Maier","Ion transport, defect chemistry, and the device physics of hybrid perovskite solar cells",79,2021,https://pubs.acs.org/doi/abs/10.1021/acsenergylett.1c00227,16
200,"Liu, LK Ono, Y Qi",Additives in metal halide perovskite films and their applications in solar cells,78,2020,https://www.sciencedirect.com/science/article/pii/S2095495619308988,13
335,"Liu, C Bi, R Guo, M Zhang, X Qu…",Electroluminescence principle and performance improvement of metal halide perovskite light‐emitting diodes,77,2021,https://onlinelibrary.wiley.com/doi/abs/10.1002/adom.202002167,15
551," Ulatowski, AD Wright, B Wenger…",Charge-Carrier Trapping Dynamics in Bismuth-Doped Thin Films of MAPbBr3 Perovskite,77,2020,https://pubs.acs.org/doi/abs/10.1021/acs.jpclett.0c01048,13
149," Kim, YR Kim, B Park, S Hong, IW Hwang, J Kim…",Simultaneously passivating cation and anion defects in metal halide perovskite solar cells using a zwitterionic amino acid additive,76,2021,https://onlinelibrary.wiley.com/doi/abs/10.1002/smll.202005608,15
353,"Zhao, P Guo, J Su, Z Fang, N Jia…",Synchronous passivation of defects with low formation energies via terdentate anchoring enabling high performance perovskite solar cells with efficiency over 24%,76,2022,https://advanced.onlinelibrary.wiley.com/doi/abs/10.1002/adfm.202200534,19
423,"Haddad, B Krogmeier, B Klingebiel…",Analyzing interface recombination in lead‐halide perovskite solar cells with organic and inorganic hole‐transport layers,76,2020,https://advanced.onlinelibrary.wiley.com/doi/abs/10.1002/admi.202000366,13
426,"Shi, Q Fang, AS Vasenko, R Long…",Structural disorder in higher-temperature phases increases charge carrier lifetimes in metal halide perovskites,75,2022,https://pubs.acs.org/doi/abs/10.1021/jacs.2c08627,19
407,Oter,Enhancing the intrinsic and extrinsic stability of halide perovskite nanocrystals for efficient and durable optoelectronics,75,2022,https://pubs.acs.org/doi/abs/10.1021/acsami.2c01822,19
304,"Yuan, G Yan, R Hong, Z Liang…",Quantifying efficiency limitations in all‐inorganic halide perovskite solar cells,75,2022,https://onlinelibrary.wiley.com/doi/abs/10.1002/adma.202108132,19
179,"Han, H Xie, EL Lim, D Bi",Review of two‐step method for lead halide perovskite solar cells,74,2022,https://onlinelibrary.wiley.com/doi/abs/10.1002/solr.202101007,18
81,"Park, JH Lee, JW Lee",Surface defect engineering of metal halide perovskites for photovoltaic applications,74,2022,https://pubs.acs.org/doi/abs/10.1021/acsenergylett.1c02847,18
80,"Zhang, ME Turiansky, JX Shen…",Defect tolerance in halide perovskites: A first-principles perspective,73,2022,https://pubs.aip.org/aip/jap/article/131/9/090901/2836495,18
402,"Musiienko, J Pipek, P Praus, M Brynza, E Belas…",Deciphering the effect of traps on electronic charge transport properties of methylammonium lead tribromide perovskite,73,2020,https://www.science.org/doi/abs/10.1126/sciadv.abb6393,12
295,"Qiao, WH Fang, R Long…",Elimination of charge recombination centers in metal halide perovskites by strain,73,2021,https://pubs.acs.org/doi/abs/10.1021/jacs.1c04442,15
500," DuBose, PV Kamat",Hole trapping in halide perovskites induces phase segregation,72,2022,https://pubs.acs.org/doi/abs/10.1021/accountsmr.2c00076,18
345,"Raval, RM Kennard, ES Vasileiadou…",Understanding instability in formamidinium lead halide perovskites: kinetics of transformative reactions at grain and subgrain boundaries,72,2022,https://pubs.acs.org/doi/abs/10.1021/acsenergylett.2c00140,18
297,"Bera, A Saha, S Mondal, A Biswas, S Mallick…",Review of defect engineering in perovskites for photovoltaic application,72,2022,https://pubs.rsc.org/en/content/articlehtml/2022/ma/d2ma00194b,18
224,"Guo, B Wang, D Lu, T Wang, T Liu, R Wang…",Ultralong carrier lifetime exceeding 20 µs in lead halide perovskite film enable efficient solar cells,72,2023,https://onlinelibrary.wiley.com/doi/abs/10.1002/adma.202212126,24
595,"Gao, Y Jiang, C Sun, J Han, T He, Y Huang…",Multifunctional naphthol sulfonic salt incorporated in lead-free 2D tin halide perovskite for red light-emitting diodes,71,2020,https://pubs.acs.org/doi/abs/10.1021/acsphotonics.0c00497,12
287,"Liu, X Zheng, OF Mohammed…",Self-assembly and regrowth of metal halide perovskite nanocrystals for optoelectronic applications,71,2022,https://pubs.acs.org/doi/abs/10.1021/acs.accounts.1c00651,18
484,"Wang, Z Zhang, L Xie, S Wang…",Recent advances and perspectives of photostability for halide perovskite solar cells,71,2022,https://advanced.onlinelibrary.wiley.com/doi/abs/10.1002/adom.202101822,18
94,"Kim, KS Kim, CW Myung",Efficient electron extraction of SnO2 electron transport layer for lead halide perovskite solar cell,71,2020,https://www.nature.com/articles/s41524-020-00370-y,12
107,"Li, X Lian, J Pang, B Luo, Y Xiao, MD Li…",Defect-related broadband emission in two-dimensional lead bromide perovskite microsheets,71,2020,https://pubs.acs.org/doi/abs/10.1021/acs.jpclett.0c02355,12
305," Hossain, GFI Toki, J Madan, R Pandey…",A comprehensive study of the optimization and comparison of cesium halide perovskite solar cells using ZnO and Cu 2 FeSnS 4 as charge transport layers,71,2023,https://pubs.rsc.org/en/content/articlehtml/2023/nj/d3nj00320e,24
460,"Liu, J Yin, BB Zhang, JK Chen, Y Zhou…",Theory-guided synthesis of highly luminescent colloidal cesium tin halide perovskite nanocrystals,70,2021,https://pubs.acs.org/doi/abs/10.1021/jacs.1c01049,14
236,"Wang, C Zuo, X Niu, L Ding, J Ding, F Hao",Recent promise of lead-free halide perovskites in optoelectronic applications,70,2023,https://www.sciencedirect.com/science/article/pii/S1385894722044059,23
308,"Wang, Y Fu, ME Ziffer, Y Dai…",Solvated electrons in solids—ferroelectric large polarons in lead halide perovskites,70,2020,https://pubs.acs.org/doi/abs/10.1021/jacs.0c10943,12
266,"Liu, H Yao, S Wang, C Wu, L Ding…",Origins and suppression of Sn (II)/Sn (IV) oxidation in tin halide perovskite solar cells,69,2023,https://onlinelibrary.wiley.com/doi/abs/10.1002/aenm.202300696,23
280,"Mahjabin, MM Haque, K Sobayel, MS Jamal…",Perceiving of defect tolerance in perovskite absorber layer for efficient perovskite solar cell,69,2020,https://ieeexplore.ieee.org/abstract/document/9109335/,12
126,"Kosar, AJ Winchester, TAS Doherty…",Unraveling the varied nature and roles of defects in hybrid halide perovskites with time-resolved photoemission electron microscopy,68,2021,https://pubs.rsc.org/en/content/articlehtml/2021/ee/d1ee02055b,14
115,"Chen, X Liu, T Wang, Y Zhao",Highly stable inorganic lead halide perovskite toward efficient photovoltaics,68,2021,https://pubs.acs.org/doi/abs/10.1021/acs.accounts.1c00343,14
208,"Kumar, S Singh, MKA Mohammed, AE Shalan",Effect of 2D perovskite layer and multivalent defect on the performance of 3D/2D bilayered perovskite solar cells through computational simulation studies,68,2021,https://www.sciencedirect.com/science/article/pii/S0038092X21004126,14
182,"Wang, Q Tian, H Zhang, H Xie, Y Du…",Managing multiple halide‐related defects for efficient and stable inorganic perovskite solar cells,67,2023,https://onlinelibrary.wiley.com/doi/abs/10.1002/anie.202305815,22
494,"Chen, L Fan, R Zhang, C Bao, H Zhao…",High‐Efficiency Formamidinium Lead Bromide Perovskite Nanocrystal‐Based Light‐Emitting Diodes Fabricated via a Surface Defect Self‐Passivation Strategy,67,2020,https://advanced.onlinelibrary.wiley.com/doi/abs/10.1002/adom.201901390,11
429,"Gao, Y Pan, F Zhou, G Niu, C Yan",Lead-free halide perovskites: a review of the structure–property relationship and applications in light emitting devices and radiation detectors,67,2021,https://pubs.rsc.org/en/content/articlehtml/2021/ta/d1ta01737c,13
428,"Xu, X Jiang, H Cai, K Chen, X Yao…",Toward a general understanding of exciton self-trapping in metal halide perovskites,67,2021,https://pubs.acs.org/doi/abs/10.1021/acs.jpclett.1c02291,13
526,"Dey, B Roose, SD Stranks",Optoelectronic properties of low‐bandgap halide perovskites for solar cell applications,66,2021,https://advanced.onlinelibrary.wiley.com/doi/abs/10.1002/adma.202102300,13
382," Du, D Shin, TK Stanev, C Musumeci, Z Xie…",Halide perovskite nanocrystal arrays: Multiplexed synthesis and size-dependent emission,66,2020,https://www.science.org/doi/abs/10.1126/sciadv.abc4959,11
343,"Reichert, J Flemming, Q An, Y Vaynzof…",Ionic-defect distribution revealed by improved evaluation of deep-level transient spectroscopy on perovskite solar cells,66,2020,https://journals.aps.org/prapplied/abstract/10.1103/PhysRevApplied.13.034018,11
47,"Sun, D Zhou, Y Ding, Y Wang, Y Wang…",… -component white light emitting diodes enabled by lanthanide ions doped lead halide perovskites via controlling Förster energy transfer and specific defect …,65,2022,https://www.nature.com/articles/s41377-022-01027-9,16
328,"Aebli, L Piveteau, O Nazarenko, BM Benin, F Krieg…","Lead-Halide Scalar Couplings in 207Pb NMR of APbX3 Perovskites (A = Cs, Methylammonium, Formamidinium; X = Cl, Br, I)",65,2020,https://www.nature.com/articles/s41598-020-65071-4,11
418,"Zhao, A Ren, P Li, Y Li, J Wu, ZM Wang",Toward continuous-wave pumped metal halide perovskite lasers: strategies and challenges,65,2022,https://pubs.acs.org/doi/abs/10.1021/acsnano.1c11539,16
344," Ali, T Alshahrani, G Murtaza",Defective perovskites Cs2SeCl6 and Cs2TeCl6 as novel high temperature potential thermoelectric materials,65,2021,https://www.sciencedirect.com/science/article/pii/S1369800121000706,13
6,"Cahen, L Kronik, G Hodes","Are defects in lead-halide perovskites healed, tolerated, or both?",64,2021,https://pubs.acs.org/doi/full/10.1021/acsenergylett.1c02027,13
539,"Zhou, L Zhang, H Li, W Shen, M Li…",Defect passivation in air‐stable tin (IV)‐halide single crystal for emissive self‐trapped excitons,64,2021,https://onlinelibrary.wiley.com/doi/abs/10.1002/adfm.202108561,13
476,"Li, X Chen, M Wang, S Cheng, D Yang…",Regulating Exciton De‐Trapping of Te4+‐Doped Zero‐Dimensional Scandium‐Halide Perovskite for Fluorescence Thermometry with Record High Time‐Resolved …,64,2023,https://advanced.onlinelibrary.wiley.com/doi/abs/10.1002/adma.202305495,21
299,"Ambrosio, D Meggiolaro, E Mosconi…",Charge localization and trapping at surfaces in lead-iodide perovskites: the role of polarons and defects,64,2020,https://pubs.rsc.org/en/content/articlehtml/2020/ta/d0ta00798f,11
279,"Liu, H Zhu, S Bai, Y Reo, M Caironi, A Petrozza…",High-performance metal halide perovskite transistors,64,2023,https://www.nature.com/articles/s41928-023-01001-2,21
188,"Svanström, AG Fernández, T Sloboda…",X-ray stability and degradation mechanism of lead halide perovskites and lead halides,64,2021,https://pubs.rsc.org/en/content/articlehtml/2021/cp/d1cp01443a,13
454,"Min, SG Ji, SI Seok",Relaxation of externally strained halide perovskite thin layers with neutral ligands,64,2022,https://www.cell.com/joule/fulltext/S2542-4351(22)00305-1,16
461," Tailor, S Satapathi",Structural disorder and spin dynamics study in millimeter-sized all-inorganic lead-free cesium bismuth halide perovskite single crystals,63,2020,https://pubs.acs.org/doi/abs/10.1021/acsaem.0c01849,10
226,"Liang, K Wang, Y Gao, BP Finkenauer…",Highly Efficient Halide Perovskite Light‐Emitting Diodes via Molecular Passivation,62,2021,https://onlinelibrary.wiley.com/doi/abs/10.1002/anie.202100243,12
83,"Maiti, S Chatterjee, L Peedikakkandy, AJ Pal",Defects and their passivation in hybrid halide perovskites toward solar cell applications,62,2020,https://onlinelibrary.wiley.com/doi/abs/10.1002/solr.202000505,10
194," Lohmann, SG Motti, RDJ Oliver…",Solvent-free method for defect reduction and improved performance of pin vapor-deposited perovskite solar cells,61,2022,https://pubs.acs.org/doi/abs/10.1021/acsenergylett.2c00865,15
510,"Chen, J Yin, Q Wei, C Wang, X Wang, H Ren…",Multiple exciton generation in tin–lead halide perovskite nanocrystals for photocurrent quantum efficiency enhancement,61,2022,https://www.nature.com/articles/s41566-022-01006-x,15
222,"Ke, S Luo, X Ren, Y Yuan",Factors influencing the nucleation and crystal growth of solution-processed organic lead halide perovskites: a review,60,2021,https://iopscience.iop.org/article/10.1088/1361-6463/abd728/meta,12
92," Lee, NG Park",Additive engineering for highly efficient and stable perovskite solar cells,60,2023,https://pubs.aip.org/aip/apr/article/10/1/011308/2881188,20
366,"Lei, Y Chen, S Xu",Single-crystal halide perovskites: opportunities and challenges,60,2021,https://www.cell.com/matter/fulltext/S2590-2385(21)00221-6,12
395," Boopathi, B Martí",Permanent lattice compression of lead-halide perovskite for persistently enhanced optoelectronic properties,60,2020,https://pubs.acs.org/doi/abs/10.1021/acsenergylett.9b02810,10
296,"Cao, J Li, H Dong, P Li, Q Fan, R Xu…",Stability improvement of tin‐based halide perovskite by precursor‐solution regulation with dual‐functional reagents,60,2021,https://advanced.onlinelibrary.wiley.com/doi/abs/10.1002/adfm.202104344,12
136," Rahman, BS Lamsal, A Gurung…",Grain boundary defect passivation of triple cation mixed halide perovskite with hydrazine-based aromatic iodide for efficiency improvement,59,2020,https://pubs.acs.org/doi/abs/10.1021/acsami.0c10448,10
294,"Wu, X Li, Y Qi, Y Zhang, L Han",Defect passivation for perovskite solar cells: from molecule design to device performance,59,2021,https://chemistry-europe.onlinelibrary.wiley.com/doi/abs/10.1002/cssc.202101573,12
282," Muscarella, B Ehrler",The influence of strain on phase stability in mixed-halide perovskites,59,2022,https://www.cell.com/joule/fulltext/S2542-4351(22)00352-X,15
391,"Li, S Luo, X Wang, L Zhang",Alternative Lone‐Pair ns2‐Cation‐Based Semiconductors beyond Lead Halide Perovskites for Optoelectronic Applications,59,2021,https://onlinelibrary.wiley.com/doi/abs/10.1002/adma.202008574,12
533,"Wang, JY Park, Akriti, L Dou",Two‐dimensional halide perovskite quantum‐well emitters: A critical review,59,2021,https://onlinelibrary.wiley.com/doi/abs/10.1002/eom2.12104,12
21,"Krishna, MA Akhavan Kazemi, M Sliwa…",Defect passivation via the incorporation of tetrapropylammonium cation leading to stability enhancement in lead halide perovskite,59,2020,https://advanced.onlinelibrary.wiley.com/doi/abs/10.1002/adfm.201909737,10
318,"V Dutt, S Akhil, N Mishra",Surface passivation strategies for improving photoluminescence and stability of cesium lead halide perovskite nanocrystals,58,2020,https://aces.onlinelibrary.wiley.com/doi/abs/10.1002/cnma.202000495,10
455," Khadka, Y Shirai, M Yanagida, H Ota…",Defect passivation in methylammonium/bromine free inverted perovskite solar cells using charge-modulated molecular bonding,58,2024,https://www.nature.com/articles/s41467-024-45228-9,29
475," Cho, J Byeon, K Jeong, J Hwang…",Investigation of defect‐tolerant perovskite solar cells with long‐term stability via controlling the self‐doping effect,58,2021,https://onlinelibrary.wiley.com/doi/abs/10.1002/aenm.202100555,12
316,"Spanopoulos, I Hadar, W Ke, P Guo…",Tunable broad light emission from 3D “hollow” bromide perovskites through defect engineering,58,2021,https://pubs.acs.org/doi/abs/10.1021/jacs.1c01727,12
3,"Brakkee, RM Williams",Minimizing defect states in lead halide perovskite solar cell materials,58,2020,https://www.mdpi.com/2076-3417/10/9/3061,10
307,"Yuan, R Li, Z Xiong, P Li…",Synergistic crystallization modulation and defects passivation via additive engineering stabilize perovskite films for efficient solar cells,57,2023,https://onlinelibrary.wiley.com/doi/abs/10.1002/adfm.202215096,19
190,"Jin, Y Peng, Y Fang, Z Ye, Z Fan, Z Liu…",Photoinduced large polaron transport and dynamics in organic–inorganic hybrid lead halide perovskite with terahertz probes,57,2022,https://www.nature.com/articles/s41377-022-00872-y,14
146,"Piveteau, M Aebli, N Yazdani, M Millen…",Bulk and nanocrystalline cesium lead-halide perovskites as seen by halide magnetic resonance,56,2020,https://pubs.acs.org/doi/abs/10.1021/acscentsci.0c00587,9
473,"Liu, X Jiang, W Feng, G Yang, X Chen…",Synergic Electron and Defect Compensation Minimizes Voltage Loss in Lead‐Free Perovskite Solar Cells,56,2023,https://onlinelibrary.wiley.com/doi/abs/10.1002/anie.202305551,19
203," Ma, JK Chen, J Yin, BB Zhang, Q Zhao…",Doping induces structural phase transitions in all-inorganic lead halide perovskite nanocrystals,56,2020,https://pubs.acs.org/doi/abs/10.1021/acsmaterialslett.0c00059,9
371,"Wu, W Gao, J Chai, C Ming, M Chen, H Zeng…",Defect tolerance in chalcogenide perovskite photovoltaic material BaZrS3,56,2021,https://link.springer.com/article/10.1007/s40843-021-1683-0,11
105," Khadka, Y Shirai, M Yanagida…",Attenuating the defect activities with a rubidium additive for efficient and stable Sn-based halide perovskite solar cells,56,2020,https://pubs.rsc.org/en/content/articlehtml/2020/tc/c9tc06206h,9
111,"Liu, P Liu, H Zhou, Y Bai, Q Chen",Understanding the defect properties of quasi-2D halide perovskites for photovoltaic applications,55,2020,https://pubs.acs.org/doi/abs/10.1021/acs.jpclett.0c00772,9
53,"Infante, L Manna",Are there good alternatives to lead halide perovskite nanocrystals?,55,2020,https://pubs.acs.org/doi/full/10.1021/acs.nanolett.0c04760,9
359,"An, N Zhang, Z Zeng, Y Cai, W Jiang, F Qi…",Optimizing crystallization in wide‐bandgap mixed halide perovskites for high‐efficiency solar cells,54,2024,https://advanced.onlinelibrary.wiley.com/doi/abs/10.1002/adma.202306568,27
112,"du Fossé, JT Mulder, G Almeida…",Limits of defect tolerance in perovskite nanocrystals: effect of local electrostatic potential on trap states,54,2022,https://pubs.acs.org/doi/abs/10.1021/jacs.2c02027,14
437," Lee, N Kumar, B Tyagi, S He, R Sahani…",Bulky organic cations engineered lead-halide perovskites: a review on dimensionality and optoelectronic applications,54,2021,https://www.sciencedirect.com/science/article/pii/S2468606921001246,11
154,"De Trizio, I Infante, L Manna",Surface chemistry of lead halide perovskite colloidal nanocrystals,54,2023,https://pubs.acs.org/doi/abs/10.1021/acs.accounts.3c00174,18
555,"Yuan, G Yan, C Dreessen, T Rudolph, M Hülsbeck…",Shallow defects and variable photoluminescence decay times up to 280 µs in triple-cation perovskites,54,2024,https://www.nature.com/articles/s41563-023-01771-2,27
45,"Xu, A Maxwell, M Wei, Z Wang, B Chen…",Defect tolerance of mixed B-site organic–inorganic halide perovskites,54,2021,https://pubs.acs.org/doi/abs/10.1021/acsenergylett.1c02105,11
502,"Qiao, WH Fang, R Long, OV Prezhdo",Atomic model for alkali metal passivation of point defects at perovskite grain boundaries,54,2020,https://pubs.acs.org/doi/abs/10.1021/acsenergylett.0c02136,9
201,"Chen, J Yang, S Wang, Y Wu, N Yuan, WH Zhang",Interfacial contact passivation for efficient and stable cesium-formamidinium double-cation lead halide perovskite solar cells,54,2020,https://www.cell.com/iscience/fulltext/S2589-0042(19)30507-3,9
582,"Kalam, R Runjhun, A Mahapatra…","Interpretation of Resistance, Capacitance, Defect Density, and Activation Energy Levels in Single-Crystalline MAPbI3",53,2020,https://pubs.acs.org/doi/abs/10.1021/acs.jpcc.9b11343,9
584," Ramadan, RDJ Oliver, MB Johnston…",Methylammonium-free wide-bandgap metal halide perovskites for tandem photovoltaics,53,2023,https://www.nature.com/articles/s41578-023-00610-9,18
270,"Zhang, W Zhao, S Olthof, S Liu",Defects in CsPbX3 Perovskite: From Understanding to Effective Manipulation for High‐Performance Solar Cells,53,2021,https://onlinelibrary.wiley.com/doi/abs/10.1002/smtd.202100725,11
230,"Srivastava, S Ranjan, L Yadav, T Sharma…",Advanced spectroscopic techniques for characterizing defects in perovskite solar cells,53,2023,https://www.nature.com/articles/s43246-023-00379-y,18
524,"Kim, KS Lee, MJ Paik, DY Lee…",Polymethyl methacrylate as an interlayer between the halide perovskite and copper phthalocyanine layers for stable and efficient perovskite solar cells,53,2022,https://onlinelibrary.wiley.com/doi/abs/10.1002/adfm.202110473,13
447,"Porwal, M Paul, H Dixit, S Mishra…",Investigation of Defects in Cs2SnI6‐Based Double Perovskite Solar Cells Via SCAPS‐1D,53,2022,https://advanced.onlinelibrary.wiley.com/doi/abs/10.1002/adts.202200207,13
78,"Tong, X Bi, S Xu, H Min, L Cheng, Z Kuang…",In situ halide exchange of cesium lead halide perovskites for blue light‐emitting diodes,52,2023,https://advanced.onlinelibrary.wiley.com/doi/abs/10.1002/adma.202207111,17
164,"Hu, L Duan, Y Yao, W Chen, Z Zhou…","Quantum dot passivation of halide perovskite films with reduced defects, suppressed phase segregation, and enhanced stability",52,2022,https://advanced.onlinelibrary.wiley.com/doi/abs/10.1002/advs.202102258,13
212,"Taheri, M Minbashi, A Hajjiah",Effect of defects on high efficient perovskite solar cells,52,2021,https://www.sciencedirect.com/science/article/pii/S0925346720309411,10
