Rank,Author,Title,Citations,Year,Source,cit/year
245,"Cao, Z Hu, Z Lin, X Guo, J Su, J Chang…",Defects and doping engineering towards high performance lead-free or lead-less perovskite solar cells,51,2022,https://www.sciencedirect.com/science/article/pii/S2095495621006641,13
122," Boldyreva, LA Frolova, IS Zhidkov…",Unravelling the Material Composition Effects on the Gamma Ray Stability of Lead Halide Perovskite Solar Cells: MAPbI3 Breaks the Records,51,2020,https://pubs.acs.org/doi/abs/10.1021/acs.jpclett.0c00581,8
563," Hiragond, NS Powar, SI In",Recent Developments in Lead and Lead-Free Halide Perovskite Nanostructures towards Photocatalytic CO2 Reduction,51,2020,https://www.mdpi.com/2079-4991/10/12/2569,8
527,"Hu, J Thiesbrummel, J Pascual, M Stolterfoht…",Narrow bandgap metal halide perovskites for all-perovskite tandem photovoltaics,51,2024,https://pubs.acs.org/doi/abs/10.1021/acs.chemrev.3c00667,26
474,"Lee, E Choi, AM Soufiani, J Lim…",Enhanced hole‐carrier selectivity in wide bandgap halide perovskite photovoltaic devices for indoor internet of things applications,51,2021,https://onlinelibrary.wiley.com/doi/full/10.1002/adfm.202008908,10
355,"Pols, JM Vicen",Atomistic Insights Into the Degradation of Inorganic Halide Perovskite CsPbI3: A Reactive Force Field Molecular Dynamics Study,51,2021,https://pubs.acs.org/doi/abs/10.1021/acs.jpclett.1c01192,10
401,"Cao, Y Damji, C Zhang, L Wu, Q Zhong, P Li…","Low‐dimensional‐networked cesium lead halide perovskites: properties, fabrication, and applications",51,2020,https://onlinelibrary.wiley.com/doi/abs/10.1002/smtd.202000303,8
532,"Gholipour, M Saliba",Bandgap tuning and compositional exchange for lead halide perovskite materials,50,2020,https://www.sciencedirect.com/science/article/pii/B9780128147276000013,8
550,"Wang, H Ma, A Wang, Z Li, J Dong, Y Liu, S Gao…",An ammonium-pseudohalide ion pair for synergistic passivating surfaces in FAPbI3 perovskite solar cells,49,2022,https://www.cell.com/matter/fulltext/S2590-2385(22)00158-8?uuid=uuid%3Afb69d5db-625d-47c7-8cc9-95fa477b9bf0,12
195,"He, Q Tang, X Liu, X Yan, K Li, D Yue",Lead-Free Cs2AgBiBr6 Perovskite with Enriched Surface Defects for Efficient Photocatalytic Hydrogen Evolution,49,2021,https://pubs.acs.org/doi/abs/10.1021/acs.energyfuels.1c01482,10
202,"Datta, BT van Gorkom, Z Chen…",Effect of light-induced halide segregation on the performance of mixed-halide perovskite solar cells,49,2021,https://pubs.acs.org/doi/abs/10.1021/acsaem.1c00707,10
214,"Chang, F Wang, W Xu, A Wang, Y Liu…",Ferrocene‐induced perpetual recovery on all elemental defects in perovskite solar cells,49,2021,https://onlinelibrary.wiley.com/doi/abs/10.1002/ange.202112074,10
41,"Hu, D Li, Q Shan, Y Dong, H Xiang…",Defect behaviors in perovskite light-emitting diodes,48,2021,https://pubs.acs.org/doi/abs/10.1021/acsmaterialslett.1c00474,10
354,"Zheng, X Yuan, J Yang, Q Li, X Yang, Y Fan…",Cu doping-enhanced emission efficiency of Mn2+ in cesium lead halide perovskite nanocrystals for efficient white light-emitting diodes,48,2020,https://www.sciencedirect.com/science/article/pii/S0022231320310462,8
406," Song, J Ge, LB Mao, KH Wang, XL Tai, Q Zhang…",Planar defect–free pure red perovskite light-emitting diodes via metastable phase crystallization,48,2022,https://www.science.org/doi/abs/10.1126/sciadv.abq2321,12
489," Ferro, M Wobben, B Ehrler",Rare-earth quantum cutting in metal halide perovskites–a review,48,2021,https://pubs.rsc.org/en/content/articlehtml/2021/mh/d0mh01470b,10
479,Mannod,Data-driven design of novel halide perovskite alloys,48,2022,https://pubs.rsc.org/en/content/articlehtml/2022/ee/d1ee02971a,12
166,"Amerling, H Lu, BW Larson, AE Maughan…",A multi-dimensional perspective on electronic doping in metal halide perovskites,47,2021,https://pubs.acs.org/doi/abs/10.1021/acsenergylett.0c02476,9
215,"Liu, M Kepenekian, S Bodnar, S Feldmann…",Bright circularly polarized photoluminescence in chiral layered hybrid lead-halide perovskites,47,2023,https://www.science.org/doi/abs/10.1126/sciadv.adh5083,16
491,"Jia, H Shi, R Yu, H Ma, Z Wang, C Zou, Z Tan",Biuret Induced Tin‐Anchoring and Crystallization‐Regulating for Efficient Lead‐Free Tin Halide Perovskite Light‐Emitting Diodes,46,2022,https://onlinelibrary.wiley.com/doi/abs/10.1002/smll.202200036,12
128,"Li, M Dailey, PJ Lohr, AD Printz",Performance and stability improvements in metal halide perovskite with intralayer incorporation of organic additives,46,2021,https://pubs.rsc.org/en/content/articlehtml/2021/ta/d1ta05252g,9
140,"Pecunia, J Zhao, C Kim, BR Tuttle…",Assessing the impact of defects on lead‐free perovskite‐inspired photovoltaics via photoinduced current transient spectroscopy,46,2021,https://onlinelibrary.wiley.com/doi/abs/10.1002/aenm.202003968,9
427,"Treglia, F Ambrosio, S Martani, G Folpini…",Effect of electronic doping and traps on carrier dynamics in tin halide perovskites,46,2022,https://pubs.rsc.org/en/content/articlehtml/2022/mh/d2mh00008c,12
400," Solari, LN Poon, M Wörle…",Stabilization of lead-reduced metal halide perovskite nanocrystals by high-entropy alloying,46,2022,https://pubs.acs.org/doi/abs/10.1021/jacs.1c12294,12
363,"Gu, D Li, L Chao, H Dong, W Hui, T Niu, C Ran…",Strain engineering of metal–halide perovskites toward efficient photovoltaics: advances and perspectives,45,2021,https://onlinelibrary.wiley.com/doi/abs/10.1002/solr.202000672,9
5,"Kang, J Li, SH Wei",Atomic-scale understanding on the physics and control of intrinsic point defects in lead halide perovskites,45,2021,https://pubs.aip.org/aip/apr/article/8/3/031302/124874,9
26," Akhavan Kazemi, P Raval…",Molecular‐Level Insight into Correlation between Surface Defects and Stability of Methylammonium Lead Halide Perovskite Under Controlled Humidity,44,2021,https://onlinelibrary.wiley.com/doi/abs/10.1002/smtd.202000834,9
321,"Chen, S Wang, X Zhang, W Zhu, Z Cao…",Reducing the interfacial voltage loss in tin halides perovskite solar cells,44,2022,https://www.sciencedirect.com/science/article/pii/S1385894722022641,11
531,"Zhou, W Qi, J Li, J Cheng, Y Li, J Luo, MJ Ko, Y Li…",Toward efficient and stable perovskite solar cells: choosing appropriate passivator to specific defects,44,2020,https://onlinelibrary.wiley.com/doi/abs/10.1002/solr.202000308,7
330,"Musiienko, DR Ceratti, J Pipek…",Defects in hybrid perovskites: the secret of efficient charge transport,44,2021,https://advanced.onlinelibrary.wiley.com/doi/abs/10.1002/adfm.202104467,9
227,Lin,Stabilizing organic–inorganic lead halide perovskite solar cells with efficiency beyond 20%,43,2020,https://www.frontiersin.org/articles/10.3389/fchem.2020.00592/full,7
117,"Quarti, C Katan, J Even","Physical properties of bulk, defective, 2D and 0D metal halide perovskite semiconductors from a symmetry perspective",43,2020,https://iopscience.iop.org/article/10.1088/2515-7639/aba6f6/meta,7
150,"Li, S Li, J Gong, X Wu, Z Li, D Gao, D Zhao, C Zhang…",Fundamental understanding of stability for halide perovskite photovoltaics: The importance of interfaces,43,2024,https://www.cell.com/chem/abstract/S2451-9294(23)00430-8,22
254,"Xu, J Liu, B Dong, J Huang, H Shi, X Xue, M Liu",Atomic-scale imaging of ytterbium ions in lead halide perovskites,43,2023,https://www.science.org/doi/abs/10.1126/sciadv.adi7931,14
323,"Choe, D Jeon, SJ Lee, J Cho",Mixed or segregated: Toward efficient and stable mixed halide perovskite-based devices,43,2021,https://pubs.acs.org/doi/abs/10.1021/acsomega.1c03714,9
246,"Zhang, G Li, C She, S Liu, F Yue, C Jing, Y Cheng…",Room temperature preparation of highly stable cesium lead halide perovskite nanocrystals by ligand modification for white light-emitting diodes,43,2021,https://link.springer.com/article/10.1007/s12274-021-3283-5,9
219,"Sun, R Yun, Y Liu, X Zhang, M Yuan, L Zhang, X Li",Ligands in Lead Halide perovskite nanocrystals: from synthesis to optoelectronic applications,42,2023,https://onlinelibrary.wiley.com/doi/abs/10.1002/smll.202205950,14
477,"Min, Y Choi, D Kim, T Park",Beyond imperfections: exploring defects for breakthroughs in perovskite solar cell research,42,2024,https://advanced.onlinelibrary.wiley.com/doi/abs/10.1002/aenm.202302659,21
320,"Wang, D Qu, B Zhou, C Shang, X Zhang, Y Tu…",Self‐Healing Behavior of the Metal Halide Perovskites and Photovoltaics,42,2024,https://onlinelibrary.wiley.com/doi/abs/10.1002/smll.202307645,21
545,"Zhai, C Chen, M Cheng",Advancing lead-free Cs2AgBiBr6 perovskite solar cells: challenges and strategies,42,2023,https://www.sciencedirect.com/science/article/pii/S0038092X23001020,14
519,"Zhang, PE Shaw, G Zhang, H Jin, M Tai…",Defect/interface recombination limited quasi-Fermi level splitting and open-circuit voltage in mono-and triple-cation perovskite solar cells,42,2020,https://pubs.acs.org/doi/abs/10.1021/acsami.0c02960,7
542," Lee, S Seo, P Nandi, HS Jung, NG Park, H Shin",Dynamic structural property of organic-inorganic metal halide perovskite,42,2021,https://www.cell.com/iscience/fulltext/S2589-0042(20)31156-1,8
22,"Bao, F Gao",Physics of defects in metal halide perovskites,42,2022,https://iopscience.iop.org/article/10.1088/1361-6633/ac7c7a/meta,10
142,"Shwetharani, V Nayak, MS Jyothi…",Review on recent advances of core-shell structured lead halide perovskites quantum dots,42,2020,https://www.sciencedirect.com/science/article/pii/S0925838820316091,7
137,"Zeiske, OJ Sandberg, N Zarrabi…",Static disorder in lead halide perovskites,42,2022,https://pubs.acs.org/doi/abs/10.1021/acs.jpclett.2c01652,10
599,"Cui, L Huang, S Zhou, C Wang, X Hu…",Lead halide coordination competition at buried interfaces for low V OC-deficits in wide-bandgap perovskite solar cells,42,2023,https://pubs.rsc.org/en/content/articlehtml/2003/6j/d3ee02818f,14
496,"Krückemeier, Z Liu, B Krogmeier…",Consistent interpretation of electrical and optical transients in halide perovskite layers and solar cells,42,2021,https://onlinelibrary.wiley.com/doi/abs/10.1002/aenm.202102290,8
178," de Holanda, RF Moral, PE Marchezi, FC Marques…",Layered metal halide perovskite solar cells: a review from structure‐properties perspective towards maximization of their performance and stability,41,2021,https://onlinelibrary.wiley.com/doi/abs/10.1002/eom2.12124,8
331," Dudipala, TH Le, W Nie, RLZ Hoye","Halide perovskites and their derivatives for efficient, high‐resolution direct radiation detection: design strategies and applications",41,2024,https://advanced.onlinelibrary.wiley.com/doi/abs/10.1002/adma.202304523,20
162,"Singh, D Kabra",Defects in halide perovskite semiconductors: impact on photo-physics and solar cell performance,41,2020,https://iopscience.iop.org/article/10.1088/1361-6463/abb487/meta,7
33," Futscher, C Deibel",Defect spectroscopy in halide perovskites is dominated by ionic rather than electronic defects,41,2021,https://pubs.acs.org/doi/full/10.1021/acsenergylett.1c02076,8
197,"Liang, W Lin, Q Zhao, X Zou, Z Lan…",Free carriers versus self-trapped excitons at different facets of Ruddlesden–Popper two-dimensional lead halide perovskite single crystals,41,2021,https://pubs.acs.org/doi/abs/10.1021/acs.jpclett.1c01148,8
199," Cohen, Y Huang, NA Bricker, CS Juhl…",Modular zwitterion-functionalized poly (isopropyl methacrylate) polymers for hosting luminescent lead halide perovskite nanocrystals,40,2021,https://pubs.acs.org/doi/abs/10.1021/acs.chemmater.1c00902,8
509,"Qian, Z Wan, H Takenaka, JK Keum, TJ Smart…",Photocarrier-induced persistent structural polarization in soft-lattice lead halide perovskites,40,2023,https://www.nature.com/articles/s41565-022-01306-x,13
249," Seok, TF Guo",Halide perovskite materials and devices,40,2020,https://www.cambridge.org/core/journals/mrs-bulletin/article/halide-perovskite-materials-and-devices/646755F548D0DBE817B991B252FB0BDB,7
113,"Hu, Y Zhu, Z Zhou, M Hao…","Post‐treatment of metal halide perovskites: from morphology control, defect passivation to band alignment and construction of heterostructures",40,2023,https://advanced.onlinelibrary.wiley.com/doi/abs/10.1002/aenm.202301888,13
404,"Liu, L Huang, X Zhou, X Wang, J Yao, Z Liu, SF Liu…",An in-situ defect passivation through a green anti-solvent approach for high-efficiency and stable perovskite solar cells,40,2021,https://www.sciencedirect.com/science/article/pii/S2095927321002371,8
213,"Nagane, S Macpherson, MA Hope…",Tetrafluoroborate‐Induced Reduction in Defect Density in Hybrid Perovskites through Halide Management,40,2021,https://advanced.onlinelibrary.wiley.com/doi/abs/10.1002/adma.202102462,8
65,"Deger, S Tan, KN Houk, Y Yang, I Yavuz",Lattice strain suppresses point defect formation in halide perovskites,40,2022,https://link.springer.com/article/10.1007/s12274-022-4141-9,10
210,"Shi, R Li, C Li","Halide perovskites for light emission and artificial photosynthesis: Opportunities, challenges, and perspectives",40,2021,https://onlinelibrary.wiley.com/doi/abs/10.1002/eom2.12074,8
62," Parfenov, OR Yamilova, LG Gutsev…",Highly sensitive and selective ammonia gas sensor based on FAPbCl 3 lead halide perovskites,39,2021,https://pubs.rsc.org/en/content/articlehtml/2021/tc/d0tc03559a,8
548," Yun, J Kim, B Gil, H Woo, K Park…",Incorporation of lithium fluoride restraining thermal degradation and photodegradation of organometal halide perovskite solar cells,39,2020,https://pubs.acs.org/doi/abs/10.1021/acsami.0c14218,6
569,"Dey, D Ghosh, M Pilot, SR Pering, B Roose…",Substitution of lead with tin suppresses ionic transport in halide perovskite optoelectronics,39,2024,https://pubs.rsc.org/en/content/articlehtml/2023/ee/d3ee03772j,20
285,"Zhang, ME Turiansky, CG Van de Walle",All-inorganic halide perovskites as candidates for efficient solar cells,39,2021,https://www.cell.com/cell-reports-physical-science/fulltext/S2666-3864(21)00319-2,8
342,"Falsini, G Roini, A Ristori, N Calisi, F Biccari…",Analysis of the Urbach tail in cesium lead halide perovskites,39,2022,https://pubs.aip.org/aip/jap/article/131/1/010902/2836243,10
242," Alharbi, A Krishna, TP Baumeler, M Dankl…",Methylammonium triiodide for defect engineering of high-efficiency perovskite solar cells,39,2021,https://pubs.acs.org/doi/abs/10.1021/acsenergylett.1c01754,8
148,"Rodà, M Fasoli, ML Zaffalon, F Cova…",Understanding thermal and a‐thermal trapping processes in lead halide perovskites towards effective radiation detection schemes,39,2021,https://onlinelibrary.wiley.com/doi/abs/10.1002/adfm.202104879,8
170,"Lee, J Lee, H Park, J Choi, HW Baac…",Defect-passivating organic/inorganic bicomponent hole-transport layer for high efficiency metal-halide perovskite device,38,2020,https://pubs.acs.org/doi/abs/10.1021/acsami.0c09784,6
290,"Li, G Zhang, Z Zhang, J Li, Z Uddin…",Defect Passivation via Additive Engineering to Improve Photodetection Performance in CsPbI2Br Perovskite Photodetectors,38,2021,https://pubs.acs.org/doi/abs/10.1021/acsami.1c19323,8
291," Goetz, Y Vaynzof",The challenge of making the same device twice in perovskite photovoltaics,38,2022,https://pubs.acs.org/doi/full/10.1021/acsenergylett.2c00463,10
159,"Zhang, M He, Q Wan, W Zheng, M Liu, C Zhang…",Suppressing thermal quenching of lead halide perovskite nanocrystals by constructing a wide-bandgap surface layer for achieving thermally stable white light …,37,2022,https://pubs.rsc.org/en/content/articlehtml/2022/sc/d1sc06554h,9
11,"Zhou, J He, T Frauenheim, OV Prezhdo…",Control of hot carrier cooling in lead halide perovskites by point defects,37,2022,https://pubs.acs.org/doi/abs/10.1021/jacs.2c08487,9
259,"Pols, T Hilpert, IAW Filot, ACT Van Duin…",What Happens at Surfaces and Grain Boundaries of Halide Perovskites: Insights from Reactive Molecular Dynamics Simulations of CsPbI3,37,2022,https://pubs.acs.org/doi/abs/10.1021/acsami.2c09239,9
394,"Xie, J Tian",Operational stability issues and challenges in metal halide perovskite light-emitting diodes,37,2022,https://pubs.acs.org/doi/abs/10.1021/acs.jpclett.1c04210,9
127,"Roy, S Ghorui, Bhawna, J Kangsabanik…",Enhanced Visible Light Absorption in Layered Cs3Bi2Br9 Halide Perovskites: Heterovalent Pb2+ Substitution-Induced Defect Band Formation,37,2020,https://pubs.acs.org/doi/abs/10.1021/acs.jpcc.0c05880,6
507,"Dobrovolsky, A Merdasa, J Li…",Relating Defect Luminescence and Nonradiative Charge Recombination in MAPbI3 Perovskite Films,37,2020,https://pubs.acs.org/doi/abs/10.1021/acs.jpclett.9b03878,6
99,"Wang, W Chu, Y Wu, D Casanova…",Electron-volt fluctuation of defect levels in metal halide perovskites on a 100 ps time scale,37,2022,https://pubs.acs.org/doi/abs/10.1021/acs.jpclett.2c01452,9
413,"Liu, W Xiang, S Mou, H Zhang, S Liu",Synergetic surface defect passivation towards efficient and stable inorganic perovskite solar cells,37,2022,https://www.sciencedirect.com/science/article/pii/S1385894722030030,9
198,"Y Lim, AM Ulatowski, C Kamaraki…",Air‐Degradation Mechanisms in Mixed Lead‐Tin Halide Perovskites for Solar Cells,37,2023,https://onlinelibrary.wiley.com/doi/abs/10.1002/aenm.202200847,12
273,"Meng, Z Lan, M Abdellah, B Yang…",Modulating charge-carrier dynamics in Mn-doped all-inorganic halide perovskite quantum dots through the doping-induced deep trap states,36,2020,https://pubs.acs.org/doi/abs/10.1021/acs.jpclett.0c01050,6
580,"Kangsabanik, S Ghorui, M Aslam, A Alam",Optoelectronic Properties and Defect Physics of Lead-Free Photovoltaic Absorbers  (),36,2020,https://journals.aps.org/prapplied/abstract/10.1103/PhysRevApplied.13.014005,6
570,"Zheng, T Pauporté",Advances in Optical Imaging and Optical Communications Based on High‐Quality Halide Perovskite Photodetectors,35,2024,https://advanced.onlinelibrary.wiley.com/doi/abs/10.1002/adfm.202311205,18
32,"Xue, G Brocks, S Tao",Intrinsic defects in primary halide perovskites: A first-principles study of the thermodynamic trends,35,2022,https://journals.aps.org/prmaterials/abstract/10.1103/PhysRevMaterials.6.055402,9
59,"Yin, Z Guo, G Chen, H Zhang, WJ Yin",Recent progress in defect tolerance and defect passivation in halide perovskite solar cells,35,2021,https://www.whxb.pku.edu.cn/EN/article/downloadArticleFile.do?attachType=PDF&id=36022,7
34,"Li, J Zhan, X Liu, J Tang, WJ Yin…",Atomistic mechanism of passivation of halide vacancies in lead halide perovskites by alkali ions,35,2021,https://pubs.acs.org/doi/abs/10.1021/acs.chemmater.0c04188,7
68,"Phung, A Mattoni, JA Smith, D Skroblin, H Köbler…",Photoprotection in metal halide perovskites by ionic defect formation,35,2022,https://www.cell.com/joule/fulltext/S2542-4351(22)00303-8,9
20,"Mrkyvkova, V Held, P Nadazdy…",Combined in Situ Photoluminescence and X-ray Scattering Reveals Defect Formation in Lead-Halide Perovskite Films,35,2021,https://pubs.acs.org/doi/abs/10.1021/acs.jpclett.1c02869,7
415,"Pratheek, T Abhinav, S Bhattacharya…",Recent progress on defect passivation in perovskites for solar cell application,35,2021,https://www.sciencedirect.com/science/article/pii/S2589299121000276,7
498," Mozur, JR Neilson",Cation dynamics in hybrid halide perovskites,35,2021,https://www.annualreviews.org/content/journals/10.1146/annurev-matsci-080819-012808,7
520,"Traore, L Pedesseau, JC Blancon…",Importance of vacancies and doping in the hole-transporting nickel oxide interface with halide perovskites,35,2020,https://pubs.acs.org/doi/abs/10.1021/acsami.9b19457,6
311,"Gao, C Yan, X Peng, W Li, J Cao, Q Wang, X Zeng…","The metal doping strategy in all inorganic lead halide perovskites: synthesis, physicochemical properties, and optoelectronic applications",34,2021,https://pubs.rsc.org/en/content/articlehtml/2021/nr/d1nr04706j,7
581,"Chen, N Wei, Y Miao, H Chen, M Ren…",Inorganic CsPbBr3 Perovskite Nanocrystals as Interfacial Ion Reservoirs to Stabilize FAPbI3 Perovskite for Efficient Photovoltaics,34,2022,https://advanced.onlinelibrary.wiley.com/doi/abs/10.1002/aenm.202200203,8
386,"Liu, S Wang, W Zhu, Z Tang, L Ding, F Hao",Highly symmetric Lewis base coordinated with Sn2+ for reducing voltage loss and retarding oxidation in tin-halide perovskite solar cells,34,2023,https://www.sciencedirect.com/science/article/pii/S1385894722054559,11
503,"Yu, H Wang, T Zhang, C Yi, G Zheng…",Color-stable blue light-emitting diodes enabled by effective passivation of mixed halide perovskites,34,2021,https://pubs.acs.org/doi/abs/10.1021/acs.jpclett.1c01547,7
39,Mannod,Defect energetics in pseudo-cubic mixed halide lead perovskites from first-principles,34,2020,https://pubs.acs.org/doi/abs/10.1021/acs.jpcc.0c02486,6
223,"Gao, Q Cai, Y He, D Zhang, Q Cao, M Zhu, Z Ma…",Highly efficient blue light-emitting diodes based on mixed-halide perovskites with reduced chlorine defects,34,2024,https://www.science.org/doi/abs/10.1126/sciadv.ado5645,17
534,"Ünlü, M Deo, S Mathur, T Kirchartz…",Bismuth-based halide perovskite and perovskite-inspired light absorbing materials for photovoltaics,34,2021,https://iopscience.iop.org/article/10.1088/1361-6463/ac3033/meta,7
441,"Ricciarelli, W Kaiser, E Mosconi, J Wiktor…",Reaction mechanism of photocatalytic hydrogen production at water/tin halide perovskite interfaces,34,2022,https://pubs.acs.org/doi/abs/10.1021/acsenergylett.2c00122,8
152,"Wang, A Wang, F Hao",Toward stable lead halide perovskite solar cells: A knob on the A/X sites components,34,2022,https://www.cell.com/iscience/fulltext/S2589-0042(21)01569-8,8
118,"Tammireddy, S Reichert, Q An, AD Taylor…",Temperature-dependent ionic conductivity and properties of iodine-related defects in metal halide perovskites,34,2021,https://pubs.acs.org/doi/abs/10.1021/acsenergylett.1c02179,7
417," Lin, HJ Lian, B Ge, Z Zhou, H Yuan, Y Hou…",Mediating the local oxygen-bridge interactions of oxysalt/perovskite interface for defect passivation of perovskite photovoltaics,34,2021,https://link.springer.com/article/10.1007/s40820-021-00683-7,7
467,"Shrivastav, J Madan, MKA Mohammed…",CsPbI3-Perovskite quantum dot solar cells: unlocking their potential through improved absorber layer characteristics and reduced defects,33,2023,https://iopscience.iop.org/article/10.1088/2053-1591/ace591/meta,11
425,"Shen, T Ye, P Yang, G Chen",All–inorganic perovskite solar cells: defect regulation and emerging applications in extreme environments,33,2024,https://onlinelibrary.wiley.com/doi/abs/10.1002/adma.202401498,16
79," Chen, Q Zhao, N Shirahata, J Yin…",Shining light on the structure of lead halide perovskite nanocrystals,33,2021,https://pubs.acs.org/doi/abs/10.1021/acsmaterialslett.1c00197,7
598,"Zhao, K Zhang, J Zhu, S Xiao, W Xiong…",Surface passivation of organometal halide perovskites by atomic layer deposition: an investigation of the mechanism of efficient inverted planar solar cells,33,2021,https://pubs.rsc.org/en/content/articlehtml/2021/na/d1na00075f,7
191,"Stanić, V Kojić, T Čižmar, K Juraić, L Bagladi…",Simulating the performance of a formamidinium based mixed cation lead halide perovskite solar cell,33,2021,https://www.mdpi.com/1996-1944/14/21/6341,7
464,Casanov,The role of anions and cations in the gas sensing mechanisms of graphene decorated with lead halide perovskite nanocrystals,33,2020,https://pubs.rsc.org/en/content/articlehtml/2020/cc/d0cc02984j,6
93,"R Perini, TAS Doherty, SD Stranks…",Pressing challenges in halide perovskite photovoltaics—from the atomic to module level,33,2021,https://www.cell.com/joule/fulltext/S2542-4351(21)00134-3,7
63,"Huang, Z Ge, X Zhang, Y Zhu",Oxygen-induced defect-healing and photo-brightening of halide perovskite semiconductors: science and application,32,2021,https://pubs.rsc.org/en/content/articlehtml/2021/ta/d0ta10946k,6
268,"Bera, RK Behera, S Das Adhikari…",Equilibriums in formation of lead halide perovskite nanocrystals,32,2021,https://pubs.acs.org/doi/abs/10.1021/acs.jpclett.1c03461,6
346,"Liang, X Cui, F Li, C Stampfl, SP Ringer…",First-principles investigation of intrinsic point defects in perovskite ,32,2021,https://journals.aps.org/prmaterials/abstract/10.1103/PhysRevMaterials.5.035405,6
566,"Pant, A Kulkarni, M Yanagida, Y Shirai…",Passivation of Bulk and Interface Defects in Sputtered-NiOx-Based Planar Perovskite Solar Cells: A Facile Interfacial Engineering Strategy with Alkali Metal Halide …,32,2021,https://pubs.acs.org/doi/abs/10.1021/acsaem.1c00032,6
365,"Calabrò, F Matteocci, B Paci, L Cinà…",Easy strategy to enhance thermal stability of planar PSCs by perovskite defect passivation and low-temperature carbon-based electrode,32,2020,https://pubs.acs.org/doi/abs/10.1021/acsami.0c05878,5
257,"Qiu, Y Liu, W Li, Y Hu",Traps in metal halide perovskites: characterization and passivation,32,2020,https://pubs.rsc.org/en/content/articlehtml/2020/nr/d0nr05739h,5
43,"Martani, Y Zhou, I Poli, E Aktas…",Defect engineering to achieve photostable wide bandgap metal halide perovskites,31,2023,https://pubs.acs.org/doi/abs/10.1021/acsenergylett.3c00610,10
138,"Chen, S Cheng, L Xiao, H Sun","Identifying, understanding and controlling defects and traps in halide perovskites for optoelectronic devices: a review",31,2020,https://iopscience.iop.org/article/10.1088/1361-6463/ab9134/meta,5
183,"Xu, W Xiang, DJ Kubicki, Y Liu, W Tress…",Simultaneous lattice engineering and defect control via cadmium incorporation for high‐performance inorganic perovskite solar cells,31,2022,https://advanced.onlinelibrary.wiley.com/doi/abs/10.1002/advs.202204486,8
75,"Xue, G Brocks, S Tao",First-principles calculations of defects in metal halide perovskites: A performance comparison of density functionals,31,2021,https://journals.aps.org/prmaterials/abstract/10.1103/PhysRevMaterials.5.125408,6
302,"Liang, F Li, X Cui, T Lv, C Stampfl, SP Ringer…",Toward stabilization of formamidinium lead iodide perovskites by defect control and composition engineering,31,2024,https://www.nature.com/articles/s41467-024-46044-x,16
